{
  "$schema": "https://json-schema.org/draft/2020-12/schema",
  "$id": "https://contract-opf.github.io/playbook-engine/spec/playbook.schema.json",
  "title": "Open Playbook Format (OPF) v0.1",
  "description": "Schema for a negotiation playbook compiled from a corpus of agreements. Superseded by v0.2 (spec/playbook.schema-0.2.json) — see docs/OPF-SPEC-v0.1.md.",
  "type": "object",
  "required": ["opf_version", "agreement_type", "baseline", "taxonomy", "clauses", "corpus", "compiler"],
  "additionalProperties": false,
  "properties": {
    "opf_version": { "type": "string", "const": "0.1" },
    "agreement_type": {
      "type": "object",
      "required": ["id", "name"],
      "additionalProperties": false,
      "properties": {
        "id": { "type": "string", "pattern": "^[a-z0-9-]+$" },
        "name": { "type": "string" },
        "description": { "type": "string" }
      }
    },
    "baseline": {
      "type": "object",
      "required": ["has_canonical_template"],
      "additionalProperties": false,
      "properties": {
        "has_canonical_template": { "type": "boolean" },
        "template_ref": {
          "type": ["object", "null"],
          "properties": {
            "document_id": { "type": "string" },
            "title": { "type": "string" },
            "source": { "type": "string" }
          }
        },
        "notes": { "type": "string" }
      }
    },
    "taxonomy": {
      "type": "object",
      "required": ["source", "entries"],
      "additionalProperties": false,
      "properties": {
        "source": { "type": "string" },
        "entries": {
          "type": "array",
          "items": {
            "type": "object",
            "required": ["id", "label", "status"],
            "additionalProperties": false,
            "properties": {
              "id": { "type": "string", "pattern": "^[a-z0-9_]+$" },
              "label": { "type": "string" },
              "status": { "type": "string", "enum": ["active", "inactive", "custom"] },
              "cuad_origin": { "type": ["string", "null"] },
              "description": { "type": "string" }
            }
          }
        }
      }
    },
    "clauses": { "type": "array", "items": { "$ref": "#/$defs/clausePosition" } },
    "clause_library": { "type": "array", "items": { "$ref": "#/$defs/clauseConcept" } },
    "corpus": {
      "type": "object",
      "required": ["documents", "stats"],
      "additionalProperties": false,
      "properties": {
        "documents": {
          "type": "array",
          "items": {
            "type": "object",
            "required": ["document_id", "provenance", "in_scope"],
            "additionalProperties": false,
            "properties": {
              "document_id": { "type": "string" },
              "title": { "type": "string" },
              "provenance": { "$ref": "#/$defs/provenance" },
              "provenance_confidence": { "type": "number", "minimum": 0, "maximum": 1 },
              "provenance_is_ambiguous": { "type": "boolean" },
              "in_scope": { "type": "boolean" },
              "scope_rationale": { "type": "string" },
              "scope_confidence": { "type": "number", "minimum": 0, "maximum": 1 },
              "versions": { "type": "integer", "minimum": 0 },
              "versions_found": { "type": "integer", "minimum": 0 },
              "versions_mined": { "type": "integer", "minimum": 0 },
              "version_ingest": {
                "type": "array",
                "items": {
                  "type": "object",
                  "required": ["version", "status"],
                  "additionalProperties": false,
                  "properties": {
                    "version": { "type": "string" },
                    "status": { "type": "string", "enum": ["ok", "failed", "unknown"] },
                    "error": { "type": ["string", "null"] },
                    "extractor": { "type": ["string", "null"] }
                  }
                }
              },
              "signed_version": { "type": ["integer", "null"] },
              "version_order_basis": { "type": "string" }
            },
            "allOf": [
              {
                "if": { "properties": { "in_scope": { "const": false } } },
                "then": { "required": ["scope_rationale"] }
              }
            ]
          }
        },
        "stats": { "type": "object" }
      }
    },
    "compiler": {
      "type": "object",
      "required": ["name", "version", "generated_at"],
      "additionalProperties": false,
      "properties": {
        "name": { "type": "string" },
        "version": { "type": "string" },
        "run_id": { "type": "string" },
        "generated_at": { "type": "string", "format": "date-time" },
        "stub_basis_present": { "type": "boolean" }
      }
    }
  },
  "$defs": {
    "provenance": { "type": "string", "enum": ["our_paper", "counterparty_paper"] },
    "citation": {
      "type": "object",
      "required": ["document_id", "version", "clause_path"],
      "additionalProperties": false,
      "properties": {
        "document_id": { "type": "string", "minLength": 1 },
        "version": { "oneOf": [{ "type": "integer" }, { "const": "template" }] },
        "clause_path": { "type": "string", "minLength": 1 },
        "char_span": {
          "type": "array",
          "items": { "type": "integer", "minimum": 0 },
          "minItems": 2,
          "maxItems": 2
        }
      }
    },
    "riskDelta": {
      "type": "object",
      "required": ["direction", "magnitude"],
      "additionalProperties": false,
      "properties": {
        "direction": { "type": "string", "enum": ["better", "neutral", "worse"] },
        "magnitude": { "type": "string", "enum": ["none", "minor", "material"] }
      }
    },
    "observation": {
      "type": "object",
      "required": ["text_summary", "example_ref", "deviation", "risk_delta", "provenance", "outcome"],
      "additionalProperties": false,
      "properties": {
        "text_summary": { "type": "string" },
        "full_text": { "type": "string" },
        "example_ref": { "$ref": "#/$defs/citation" },
        "deviation": { "type": "string", "enum": ["none", "reworded_equivalent", "substantive"] },
        "risk_delta": { "$ref": "#/$defs/riskDelta" },
        "provenance": { "$ref": "#/$defs/provenance" },
        "outcome": { "type": "string", "enum": ["signed", "proposed_then_reversed"] },
        "precedent_count": { "type": "integer", "minimum": 1 }
      }
    },
    "clausePosition": {
      "type": "object",
      "required": ["id", "taxonomy_id", "title", "observed_positions", "rollup"],
      "additionalProperties": false,
      "properties": {
        "id": { "type": "string" },
        "taxonomy_id": { "type": "string" },
        "title": { "type": "string" },
        "our_standard": {
          "type": ["object", "null"],
          "required": ["text", "source_ref"],
          "additionalProperties": false,
          "properties": {
            "text": { "type": "string" },
            "source_ref": { "$ref": "#/$defs/citation" }
          }
        },
        "observed_positions": { "type": "array", "items": { "$ref": "#/$defs/observation" } },
        "rollup": {
          "type": "object",
          "required": ["position", "confidence"],
          "additionalProperties": false,
          "properties": {
            "position": { "type": "string", "enum": ["standard", "acceptable_variants_exist", "negotiable", "hold_firm"] },
            "acceptable_if": { "type": "array", "items": { "type": "string" } },
            "fallbacks": { "type": "array", "items": { "$ref": "#/$defs/observation" } },
            "rejected": { "type": "array", "items": { "$ref": "#/$defs/observation" } },
            "confidence": {
              "type": "object",
              "required": ["score"],
              "additionalProperties": false,
              "properties": {
                "score": { "type": "number", "minimum": 0, "maximum": 1 },
                "basis": { "type": "string" },
                "n_our_paper": { "type": "integer", "minimum": 0 },
                "n_counterparty_paper": { "type": "integer", "minimum": 0 },
                "evidence_sufficient": { "type": "boolean" }
              }
            }
          }
        }
      }
    },
    "clauseConcept": {
      "type": "object",
      "required": ["concept_id", "taxonomy_id", "description", "accepted_forms"],
      "additionalProperties": false,
      "properties": {
        "concept_id": { "type": "string" },
        "taxonomy_id": { "type": "string" },
        "description": { "type": "string" },
        "risk_profile": { "type": "string" },
        "accepted_forms": {
          "type": "array",
          "items": {
            "type": "object",
            "required": ["text_summary", "example_ref", "provenance"],
            "additionalProperties": false,
            "properties": {
              "text_summary": { "type": "string" },
              "example_ref": { "$ref": "#/$defs/citation" },
              "provenance": { "$ref": "#/$defs/provenance" },
              "risk_delta_vs_our_standard": { "$ref": "#/$defs/riskDelta" }
            }
          }
        },
        "notes": { "type": "string" }
      }
    }
  }
}
